"Status","Start Time","Stop Time","Duration in ms","Parent Suite","Suite","Sub Suite","Test Class","Test Method","Name","Description"
"passed","Fri Oct 27 14:32:59 GMT 2023","Fri Oct 27 14:32:59 GMT 2023","2","","Milestones","","Create new milestone for authorized user","","Create new milestone for authorized user",""
"broken","Fri Oct 27 14:32:57 GMT 2023","Fri Oct 27 14:32:57 GMT 2023","7","","Labels","","Add label to existing issue for authorized user","","Add label to existing issue for authorized user",""
"passed","Fri Oct 27 14:32:57 GMT 2023","Fri Oct 27 14:32:57 GMT 2023","2","","Labels","","Delete existing label via api","","Delete existing label via api",""
"passed","Fri Oct 27 14:32:57 GMT 2023","Fri Oct 27 14:32:59 GMT 2023","2003","","Labels","","Delete existing label for authorized user","","Delete existing label for authorized user",""
"passed","Fri Oct 27 14:32:57 GMT 2023","Fri Oct 27 14:32:57 GMT 2023","20","","Labels","","Create new label via api","","Create new label via api",""
"passed","Fri Oct 27 14:32:57 GMT 2023","Fri Oct 27 14:32:57 GMT 2023","2","","Labels","","Create new label for authorized user","","Create new label for authorized user",""
"passed","Fri Oct 27 14:32:59 GMT 2023","Fri Oct 27 14:32:59 GMT 2023","4","","Milestones","","Close existing milestone for authorized user","","Close existing milestone for authorized user",""
